{
  "$schema": "http://json-schema.org/schema",
  "type": "object",
  "description": "베이스 아이템",
  "required": ["level", "rarity", "itype", "attrs"],
  "properties": {
    "name": { "type": "string", "description": "아이템 이름" },
    "image" : { "type": "string", "description": "아이템 아이콘 이름" },
    "overlay" : { "type": "string", "description": "아이템 오버레이 아이콘 이름 (환영극단 2막 등)"},
    "level" : { "type" : "number", "description": "아이템 레벨 (아이템 착용가능 레벨)" },
    "rarity":   { "type": "string", "description": "아이템 레어도",
      "enum": ["Common", "Uncommon", "Rare", "Unique", "Epic"]
    },
    "itype": { "$ref": "./itype.json" },
    "material": {
      "type": "string",
      "description": "(방어구일 때만) 재질",
      "enum": ["천", "가죽", "경갑", "중갑", "판금"]
    },
    "who": {
      "type": "array",
      "description": "이 아이템을 쓸 수 있는 직업",
      "items": { 
        "$ref": "./dfclassname.json"
      }
    },
    "attrs": {
      "description": "아이템 효과",
      "$ref": "./base-attrs.json"
    },
    "branch": {
      "description": "특정 조건에만 적용되는 효과 모음",
      "type": "array",
      "items": {
        "$ref": "./conditional.json"
      }
    },
    "gives": {
      "description": "특정 조건을 만족할때 파티원 모두에게 적용되는 효과 모음",
      "type": "array",
      "items": {
        "$ref": "./conditional.json"        
      }
    },
    "exclusive": {
      "type": "array",
      "items": {
        "$ref": "./exclusive-set.json"
      }
    }
  },
  "additionalProperties": false
}